abbr,LongName,cases_per_100K,case_date,vax_date,Census2019,Series_Complete_Pop_Pct,any_mandate_in_place,description_of_mandate,statewide_face_mask_requirement,emergency_declaration,status_of_reopening,state_abbv
AK,Alaska,307.6,2022-07-12,2022-07-06,731545,62.8,No,NA,No,No,Reopened,AK
AL,Alabama,388.6,2022-07-12,2022-07-06,4903185,51.6,Prohibited,"State and local governments are prohibited from requiring immunization as a condition of receiving government services or entering a government building. Institutions of education may only require students to prove vaccination status for vaccines that were already required as of January 1, 2021. Private businesses may not refuse to serve a customer based on the customers immunization status.",No,Yes,Reopened,AL
AR,Arkansas,307.8,2022-07-12,2022-07-06,3017804,55.1,Prohibited,"State and local governments are prohibited from mandating COVID-19 vaccination. Vaccination cannot be required as a condition of employment, except in the case of state-owned medical facilities.",No,No,Reopened,AR
AZ,Arizona,277.5,2022-07-12,2022-07-06,7278717,62.5,Prohibited,State and local governments are prohibited from requiring any person to be vaccinated for COVID-19. State and local governments are also prohibited from establishing a vaccine passport.,No,Yes,Reopened,AZ
CA,California,310.8,2022-07-12,2022-07-06,39512223,72.9,Yes,"State employees must be vaccinated against COVID-19 or undergo mandatory COVID-19 testing effective 8/2/2021. 
Employees of healthcare facilities must be vaccinated against COVID-19 effective 9/30/2021. 
School employees must be vaccinated against COVID-19 or undergo regular COVID-19 testing effective 10/15/2021. 
Participants at indoor events larger than 1,000 must present proof of vaccination or a negative test within 72 hours  of the event effective 9/20/21",Unvaccinated People Only,Yes,Reopened,CA
CO,Colorado,208.6,2022-07-12,2022-07-06,5758736,70.9,Yes,"All unvaccinated state employees will be subject to regular testing effective 9/20/2021. Employees of the Departments of Corrections, Human Services,  and Public Health and Environment will be required to be vaccinated or face termination. Colorado Board of Health mandated that all employees, direct contractors, and support staff (covered employees) in licensed healthcare settings in Colorado receive their first dose of the COVID-19 vaccine by September 30, 2021 and be fully vaccinated no later than October 31.",No,No,Reopened,CO
CT,Connecticut,137.4,2022-07-12,2022-07-06,3565287,80.2,Yes,"Employees at long-term care facilities must be vaccinated or subject to weekly testing. Facilities that do not comply will be fined a $20,000 civil penalty per day effective 9/7/2021. State employees and staff of all childcare facilities and preK-12 schools statewide must have received at least one dose of a COVID-19 vaccine effective 9/27/21.  Date for the full vaccination of staff in long-term facilities was extended to 9/27",Unvaccinated People Only,Yes,Reopened,CT
DC,District of Columbia,248.2,2022-07-12,2022-07-06,705749,76.3,Yes,"City employees, including school personnel, must be vaccinated against COVID-19 or undergo regular testing effective 9/19/2021. All healthcare workers must be vaccinated against COVID-19 effective 9/30/21 (exemptions granted for medical or religious reasons but unvaccinated individuals must undergo regular testing)",No,Yes,Reopened,DC
DE,Delaware,205.7,2022-07-12,2022-07-06,973764,70.2,Yes,Staff in long-term care and other health care facilities are required to provide proof of COVID-19 vaccination or undergo regular testing. State employees required to provide proof of COVID-19 vaccination or undergo regular testing effective 9/30/21,No,Yes,Reopened,DE
FL,Florida,354.3,2022-07-12,2022-07-06,21477737,67.7,Prohibited,State and local governments are prohibited from requiring individuals to provide documentation of COVID-19 vaccination to gain access to government services or facilities. An educational institution may not require students or residents to provide documentation of COVID-19 vaccination for attendance or enrollment. Businesses are prohibited from requiring customers to provide documentation of COVID-19 vaccination.,No,No,Reopened,FL
GA,Georgia,188.3,2022-07-12,2022-07-06,10617423,55.5,No,NA,No,Yes,Reopened,GA
HI,Hawaii,289.7,2022-07-12,2022-07-06,1415872,79.1,Yes,"State and county employees must be vaccinated against COVID-19 or they will be subject to testing at least once per week effective 8/16/2021. Unvaccinated employees may be restricted from work-related travel. In addition, state contractors must be vaccinated or submit to regular testing and all visitors to state facilities must show proof of vaccination or a negative COVID-19 test to enter the facility effective 9/13/21.",Indoor Only,Yes,Imposing New Restrictions,HI
IA,Iowa,151.4,2022-07-12,2022-07-06,3155070,62.5,No,NA,No,Yes,Reopened,IA
ID,Idaho,273,2022-07-12,2022-07-06,1787065,55.9,Prohibited,State is prohibited from requiring individuals to show proof of COVID-19 vaccination to access state services or facilities and is prohibited from issuing a vaccine passport,No,Yes,Reopened,ID
IL,Illinois,311.6,2022-07-12,2022-07-06,12671821,69.1,Yes,State employees working in congregate care facilities must be vaccinated against COVID-19 effective 10/4/2021.  All health care workers and pre-K-12 school personnel must get vaccinated by 9/19/21 or submit to regular testing,Indoor Only,Yes,Reopened,IL
IN,Indiana,217.7,2022-07-12,2022-07-06,6732219,56.5,No,NA,No,Yes,Reopened,IN
KS,Kansas,185.2,2022-07-12,2022-07-06,2913314,62.6,No,NA,No,No,Reopened,KS
KY,Kentucky,252.6,2022-07-12,2022-07-06,4467673,57.9,No,NA,No,Yes,Reopened,KY
LA,Louisiana,354,2022-07-12,2022-07-06,4648794,54,No,NA,No,Yes,Reopened,LA
MA,Massachusetts,143.7,2022-07-12,2022-07-06,6892503,80.1,Yes,Long-term care facility personnel must be vaccinated against COVID-19 effective 10/10/2021.  State executive branch employees must be be vaccinated against COVID-19 effective 10/17/21,No,No,Reopened,MA
MD,Maryland,223.5,2022-07-12,2022-07-06,6045680,76.5,Yes,State employees in congregate care settings and employees of nursing homes and hospitals are required to provide proof of COVID-19 vaccination or they will be subject to strict masking policies and mandatory COVID-19 testing effective 9/1/2021.,No,No,Reopened,MD
ME,Maine,129.3,2022-07-12,2022-07-06,1344212,80.6,Yes,"All health care workers, EMS personnel, and dentists must be vaccinated by 10/29/21 or will be excluded from the workplace for the duration of the Department's declared public health emergency",No,No,Reopened,ME
MI,Michigan,131.2,2022-07-12,2022-07-06,9986857,60.7,No,NA,No,No,Reopened,MI
MN,Minnesota,128.4,2022-07-12,2022-07-06,5639632,69.8,Yes,State agency employees working in person will be required to show proof of vaccination and attest to their vaccination status effective 9/8/21,No,No,Reopened,MN
MO,Missouri,207.1,2022-07-12,2022-07-06,6137428,56.7,No,NA,No,No,Reopened,MO
MS,Mississippi,407.5,2022-07-12,2022-07-06,2976149,52.3,No,NA,No,Yes,Reopened,MS
MT,Montana,205.8,2022-07-12,2022-07-06,1068778,57.4,Prohibited,"Businesses, governmental entities, and places of public accommodation may not refuse to serve or withhold goods from any person based on vaccination status.",No,No,Reopened,MT
NC,North Carolina,27.9,2022-07-12,2022-07-06,10488084,62.6,Yes,State employees must provide proof of vaccination or undergo testing on a weekly basis and wear a mask while at work effective 9/1/2021.,No,Yes,Reopened,NC
ND,North Dakota,259.4,2022-07-12,2022-07-06,762062,56.1,No,NA,No,No,Reopened,ND
NE,Nebraska,292,2022-07-12,2022-07-06,1934408,64.1,No,NA,No,No,Reopened,NE
NH,New Hampshire,147.8,2022-07-12,2022-07-06,1359711,71.7,Prohibited,No person may be compelled to receive an immunization for COVID-19 in order to access public goods or facilities.,No,No,Reopened,NH
NJ,New Jersey,250.3,2022-07-12,2022-07-06,8882190,76.5,Yes,Employees of healthcare facilities must be vaccinated against COVID-19 or undergo COVID-19 testing at least once per week effective 9/7/2021. State employees and pre-K-12 school personnel must be fully vaccinated against COVID-19 or be subject to COVID-19 testing at minimum one to two times per week effective 10/18/2021.,No,No,Reopened,NJ
NM,New Mexico,413.1,2022-07-12,2022-07-06,2096829,72.1,Yes,State employees must provide proof of vaccination or undergo testing on a weekly basis and wear a mask while at work effective 8/2/2021. School employees must submit proof of vaccination or undergo weekly COVID-19 testing and wear a mask effective 8/23/2021. All hospital employees and employees of congregate care facilities must submit proof of vaccination or qualify for an exemption effective 8/30/2021. COVID-19 vaccination is required for all people attending the NM state fair unless they qualify for an exemption.,Indoor Only,Yes,Reopened,NM
NV,Nevada,279.6,2022-07-12,2022-07-06,3080156,61.5,Yes,"State employees must be vaccinated against COVID-19 or undergo weekly testing effective 8/15/2021. State universities, colleges and community colleges are required to implement a COVID-19 vaccine requirement for enrollment after 11/1/21. Employees, contractors and state employees who transfer to DHHS or NDOC must provide vaccination proof by 11/1/21",Unvaccinated People Only,Yes,Reopened,NV
NY,New York,247.9,2022-07-12,2022-07-06,19453561,77.9,Yes,All state employees must submit proof of COVID-19 vaccination or undergo weekly COVID-19 testing effective 9/5/2021. MTA and Port Authority employees are also required to submit proof of COVID-19 vaccination or undergo weekly COVID-19 testing by 9/5/2021. All healthcare workers in the state must provide proof of COVID-19 vaccination effective 9/27/2021.,Unvaccinated People Only,No,Reopened,NY
OH,Ohio,161.2,2022-07-12,2022-07-06,11689100,58.8,No,K-12 schools and institutions of higher education cannot mandate a vaccine that has not received full FDA approval.,No,No,Reopened,OH
OK,Oklahoma,260.7,2022-07-12,2022-07-06,3956971,58,No,NA,No,No,Reopened,OK
OR,Oregon,321.2,2022-07-12,2022-07-06,4217737,70.3,Yes,"State employees, healthcare workers, and school employees must be vaccinated against COVID-19 effective 10/18/2021 or 6 weeks after full FDA approval for the vaccine, whichever is later.",Yes,Yes,Reopened,OR
PA,Pennsylvania,175.2,2022-07-12,2022-07-06,12801989,69.7,Yes,"State employees in healthcare facilities or high-risk congregate settings are required to be vaccinated or undergo weekly testing effective 9/7/2021. For large events, the host can require attendees to be vaccinated to avoid implementing the mask mandate.",No,No,Reopened,PA
RI,Rhode Island,140.6,2022-07-12,2022-07-06,1059361,83.8,Yes,Employees of healthcare facilities must be vaccinated against COVID-19 effective 10/10/2021.,No,Yes,Reopened,RI
SC,South Carolina,255.7,2022-07-12,2022-07-06,5148714,57.7,No,NA,No,No,Reopened,SC
SD,South Dakota,133.6,2022-07-12,2022-07-06,884659,62.7,Prohibited,NA,No,No,Reopened,SD
TN,Tennessee,248.9,2022-07-12,2022-07-06,6829174,55,Prohibited,Government entities may not enact a policy that would require individuals to be vaccinated against COVID-19.,No,No,Reopened,TN
TX,Texas,269.3,2022-07-12,2022-07-06,28995881,62.4,Prohibited,"Government entities, state agencies, political subdivisions, and any public or private entity that is receiving or will receive public funds may not require an individual to receive COVID-19 vaccination or provide documentation regarding vaccination status as a condition of receiving services or entering any place.",No,Yes,Reopened,TX
UT,Utah,214.4,2022-07-12,2022-07-06,3205958,64.8,Prohibited,"Government entities may not require individuals to receive the COVID-19 vaccine, unless they work in public health or a medical setting.",No,Yes,Reopened,UT
VA,Virginia,241.5,2022-07-12,2022-07-06,8535519,73.9,Yes,State employees are required to provide proof of COVID-19 vaccination or undergo weekly testing for COVID-19 effective 9/1/2021.,No,No,Reopened,VA
VT,Vermont,62.7,2022-07-12,2022-07-06,623989,82,No,NA,No,No,Reopened,VT
WA,Washington,238.6,2022-07-12,2022-07-06,7614893,73,Yes,"State executive branch employees and on-site contractors and volunteers, along with public and private health care and long-term care workers; and any worker in educational settings must be fully vaccinated against COVID-19 by 10/18/21
",Indoor Only,Yes,Reopened,WA
WI,Wisconsin,177.2,2022-07-12,2022-07-06,5822434,66.2,No,NA,No,No,Reopened,WI
WV,West Virginia,347,2022-07-12,2022-07-06,1792147,58.2,No,NA,No,Yes,Reopened,WV
WY,Wyoming,200.9,2022-07-12,2022-07-06,578759,51.4,No,NA,No,Yes,Reopened,WY
